{
  "$schema": "https://json-schema.org/draft/2020-12/schema",
  "$id": "https://github.com/Max-ctrl-v/glassbox-protocol/protocol/decision-record.schema.json",
  "title": "AI Decision Record (AIDR)",
  "description": "A record of one consequential AI-assisted output: what was asked, what the model relied on, how confident it was, where the data went, and whether a human reviewed it. Written at decision time, not reconstructed later.",
  "type": "object",
  "required": [
    "aidr_version",
    "id",
    "system",
    "purpose",
    "input_summary",
    "output_summary",
    "data_recipients",
    "human_review"
  ],
  "additionalProperties": false,
  "allOf": [
    {
      "description": "reasoning_summary, confidence and limitations are model judgements. Every record requires them EXCEPT one written purely by a capture layer (attestation.method = application_captured), which cannot assess them and must not invent them. Records with no attestation — including all v0.1 records — still require them.",
      "if": {
        "properties": { "attestation": { "type": "object", "properties": { "method": { "type": "string", "const": "application_captured" } }, "required": ["method"] } },
        "required": ["attestation"]
      },
      "then": true,
      "else": { "required": ["reasoning_summary", "confidence", "limitations"] }
    },
    {
      "description": "timestamp is required unless a capture-only record genuinely had no runtime-supplied time to record. Any self-reported or hybrid record must carry one.",
      "if": {
        "properties": { "attestation": { "type": "object", "properties": { "method": { "type": "string", "const": "application_captured" } }, "required": ["method"] } },
        "required": ["attestation"]
      },
      "then": true,
      "else": { "required": ["timestamp"] }
    }
  ],
  "properties": {
    "aidr_version": {
      "description": "Version of this schema the record conforms to. 0.1 records stay valid; 0.2 adds the optional 'trace' and 'attestation' fields.",
      "type": "string",
      "enum": ["0.1", "0.2"]
    },
    "id": {
      "description": "Unique identifier for this record. UUID or any collision-free scheme.",
      "type": "string",
      "minLength": 1
    },
    "timestamp": {
      "description": "When the output was produced, ISO 8601 with timezone.",
      "type": "string",
      "format": "date-time"
    },
    "system": {
      "description": "Which AI system produced this output. Should reference a system card.",
      "type": "object",
      "required": ["name", "provider", "model"],
      "additionalProperties": false,
      "properties": {
        "name": { "type": "string", "minLength": 1, "description": "Internal name of the deployed system, e.g. 'support-assistant'." },
        "provider": { "type": "string", "minLength": 1, "description": "Legal entity providing the model, e.g. 'Anthropic PBC'." },
        "model": { "type": "string", "minLength": 1, "description": "Model identifier as reported by the provider." },
        "model_version": { "type": "string", "description": "Version or snapshot, where the provider exposes one." },
        "system_card": { "type": "string", "description": "Path or URL to the system card for this system." }
      }
    },
    "purpose": {
      "description": "What this AI output was for, in plain language. An affected person should understand it.",
      "type": "string",
      "minLength": 10
    },
    "input_summary": {
      "description": "What was asked and what context was supplied. Summarise; do not copy personal data into the record.",
      "type": "string",
      "minLength": 1
    },
    "output_summary": {
      "description": "What the AI produced or recommended.",
      "type": "string",
      "minLength": 1
    },
    "data_recipients": {
      "description": "Every party that received data in the course of producing this output. GDPR Art. 13(1)(e), 15(1)(c). An empty array means the model ran entirely on infrastructure you control; state that explicitly rather than omitting recipients.",
      "type": "array",
      "items": {
        "type": "object",
        "required": ["processor", "server_region", "data_categories"],
        "additionalProperties": false,
        "properties": {
          "processor": { "type": "string", "minLength": 1, "description": "Legal entity receiving the data." },
          "server_region": { "type": "string", "minLength": 1, "description": "Where processing took place, e.g. 'US', 'EU (eu-central-1, Frankfurt)', 'on-premise'." },
          "data_categories": {
            "type": "array",
            "minItems": 1,
            "items": { "type": "string" },
            "description": "Categories of data transferred, e.g. 'customer name', 'support ticket text'. Flag GDPR Art. 9 special categories explicitly."
          },
          "transfer_mechanism": {
            "type": "string",
            "description": "Legal basis for a third-country transfer, e.g. 'SCCs (2021/914)', 'adequacy decision', 'not applicable — EU processing'."
          },
          "retention": { "type": "string", "description": "How long the processor keeps it, e.g. '30 days abuse monitoring', 'zero retention'." }
        }
      }
    },
    "reasoning_summary": {
      "description": "How the output was reached, in terms a non-specialist can follow. This is a self-report, not a faithful account of the model's internal computation — see the honest-limits note in the README.",
      "type": "string",
      "minLength": 10
    },
    "trace": {
      "description": "The steps taken to reach the output, in order. Each step is marked with its provenance: 'system_observed' means a capture layer logged the event as it happened; 'self_reported' means the model is describing it. A trace is required (by the skill, not the schema) whenever the output used tools or retrieval — where there are steps, they must be shown. See docs/design/2026-07-25-audit-trail-v0.2.md.",
      "type": "array",
      "items": {
        "type": "object",
        "required": ["step", "type", "provenance", "summary"],
        "additionalProperties": false,
        "properties": {
          "step": { "type": "integer", "minimum": 1, "description": "1-based position in the sequence." },
          "at": { "type": "string", "format": "date-time", "description": "When this step happened, ISO 8601. Required in practice for system_observed steps; a self_reported step may not have a reliable time." },
          "type": {
            "type": "string",
            "enum": ["task_received", "retrieval", "tool_call", "model_reasoning", "decision", "output", "disclosure", "handoff"],
            "description": "What kind of step this was."
          },
          "provenance": {
            "type": "string",
            "enum": ["system_observed", "self_reported"],
            "description": "'system_observed': a capture layer logged this actual event. 'self_reported': the model's own account, not independently grounded. A step that cannot state which it is defeats the purpose of the trace."
          },
          "summary": { "type": "string", "minLength": 1, "description": "What happened at this step, in plain language. Summarise; never copy personal data in." },
          "refs": {
            "type": "array",
            "items": { "type": "string" },
            "description": "Identifiers for what this step touched or produced — a query, a document id, a tool result reference. Not the data itself."
          }
        }
      }
    },
    "attestation": {
      "description": "How this record came to exist, so an inspector need not infer its trust tier. Answers the first audit question: did your system capture this, or did the model write it about itself?",
      "type": "object",
      "required": ["method"],
      "additionalProperties": false,
      "properties": {
        "method": {
          "type": "string",
          "enum": ["model_self_report", "application_captured", "hybrid"],
          "description": "'model_self_report': the model emitted the whole record (tier 1). 'application_captured': a capture layer built it from observed events. 'hybrid': observed steps plus model-supplied reasoning/confidence/limitations."
        },
        "captured_by": { "type": "string", "description": "The capture layer that wrote it, e.g. 'glassbox-hook@0.2 (claude-code)'. Empty for a bare self-report — and that emptiness is itself informative." },
        "created_at": { "type": "string", "format": "date-time", "description": "When the record was assembled, ISO 8601." }
      }
    },
    "sources": {
      "description": "What the output actually relied on: documents, records, retrieved passages, tool results.",
      "type": "array",
      "items": {
        "type": "object",
        "required": ["type", "reference"],
        "additionalProperties": false,
        "properties": {
          "type": {
            "type": "string",
            "enum": ["document", "database", "web", "tool_output", "user_provided", "model_knowledge"],
            "description": "'model_knowledge' means it came from training data and is not independently verifiable."
          },
          "reference": { "type": "string", "minLength": 1, "description": "Identifier, path, URL, or query." },
          "relevance": { "type": "string", "description": "What this source contributed." }
        }
      }
    },
    "confidence": {
      "description": "How reliable this output is. 'level' is required; 'rationale' explains it.",
      "type": "object",
      "required": ["level"],
      "additionalProperties": false,
      "properties": {
        "level": { "type": "string", "enum": ["high", "medium", "low"] },
        "rationale": { "type": "string", "description": "Why this level. What would raise or lower it." }
      }
    },
    "limitations": {
      "description": "What this output does not cover, what could make it wrong, what was assumed. An empty array asserts there are none — rarely true. State at least one limitation or justify the emptiness in reasoning_summary.",
      "type": "array",
      "items": { "type": "string", "minLength": 1 }
    },
    "human_review": {
      "description": "Whether a human checked this before it took effect. Central to AI Act Art. 14 and 26(2), the Art. 50(4) editorial-review exemption, and GDPR Art. 22.",
      "type": "object",
      "required": ["required"],
      "additionalProperties": false,
      "properties": {
        "required": { "type": "boolean", "description": "Whether human review was required before this output could take effect." },
        "reason": { "type": "string", "description": "Why review was or was not required." },
        "reviewer": { "type": "string", "description": "Who reviewed. A role plus an identifier, not just 'a manager'." },
        "decision": {
          "type": "string",
          "enum": ["approved", "modified", "rejected", "pending"],
          "description": "Outcome. A record emitted at generation time carries 'pending' — the review has not happened yet, and the model must never write anything else here. The reviewer replaces it with the real outcome, adding reviewer and timestamp. If every completed record in your store says 'approved', that is a rubber-stamp signal, not a clean sheet — see gdpr-mapping.md."
        },
        "decision_notes": { "type": "string", "description": "What the reviewer changed or why they agreed." },
        "timestamp": { "type": "string", "format": "date-time", "description": "When the review happened." }
      },
      "allOf": [
        {
          "if": { "properties": { "required": { "const": true } }, "required": ["required"] },
          "then": { "required": ["required", "decision"] }
        },
        {
          "if": {
            "properties": { "decision": { "enum": ["approved", "modified", "rejected"] } },
            "required": ["decision"]
          },
          "then": { "required": ["reviewer", "timestamp"] }
        }
      ]
    },
    "affected_persons": {
      "description": "Whether this output affects identifiable people, and whether they were told. Drives AI Act Art. 26(11) and 86, and GDPR Art. 22.",
      "type": "object",
      "additionalProperties": false,
      "properties": {
        "affects_individuals": { "type": "boolean" },
        "categories": { "type": "array", "items": { "type": "string" }, "description": "e.g. 'job applicants', 'loan applicants'." },
        "notified": { "type": "boolean", "description": "Whether affected persons were informed that AI was involved." },
        "explanation_available": { "type": "boolean", "description": "Whether an Art. 86 explanation can be produced on request." }
      }
    },
    "disclosure": {
      "description": "Which AI Act Art. 50 disclosures were made for this interaction.",
      "type": "object",
      "additionalProperties": false,
      "properties": {
        "ai_interaction_disclosed": { "type": "boolean", "description": "Art. 50(1) — the person was told they were dealing with AI." },
        "synthetic_content_marked": { "type": "boolean", "description": "Art. 50(2) — machine-readable marking applied." },
        "marking_method": { "type": "string", "description": "e.g. 'C2PA manifest', 'SynthID', 'metadata tag'." },
        "deepfake_disclosed": { "type": "boolean", "description": "Art. 50(4)." },
        "disclosure_text": { "type": "string", "description": "The wording actually shown." }
      }
    },
    "risk_classification": {
      "description": "AI Act risk class of the system producing this output.",
      "type": "string",
      "enum": ["prohibited", "high_risk", "limited_risk_transparency", "minimal_risk", "not_assessed"]
    },
    "retention_until": {
      "description": "When this record may be deleted, ISO 8601. AI Act Art. 26(6) requires at least six months for high-risk system logs; other laws may require longer.",
      "type": "string",
      "format": "date"
    },
    "prev_record_hash": {
      "description": "SHA-256 of the previous record in the chain, hex-encoded. Optional tamper-evidence — see logging-guide.md.",
      "type": "string",
      "pattern": "^[a-f0-9]{64}$"
    },
    "signature": {
      "description": "Optional Ed25519 signature over the canonical record with this field removed. Raises tamper-evidence from 'an edit is visible' to 'forgery needs the private key'. See capture/lib/chain.mjs and logging-guide.md. Not immutability — a compromised key defeats it.",
      "type": "object",
      "required": ["algorithm", "value"],
      "additionalProperties": false,
      "properties": {
        "algorithm": { "type": "string", "const": "ed25519" },
        "value": { "type": "string", "pattern": "^[A-Za-z0-9+/]+=*$", "description": "Base64-encoded signature." },
        "public_key_id": { "type": "string", "description": "Identifier for the key that signed it, so a verifier knows which public key to use." }
      }
    },
    "tags": {
      "description": "Free-form labels for retrieval.",
      "type": "array",
      "items": { "type": "string" }
    }
  }
}
